,ltable_ABV,ltable_Beer_Name,ltable_Brew_Factory_Name,ltable_Style,rtable_ABV,rtable_Beer_Name,rtable_Brew_Factory_Name,rtable_Style,outcome
0,12.00 %,Pike Old Bawdy Barley Wine,Elevator Brewery & Draught Haus,American Barleywine,4.60 %,Legends of the Bay Giant_s Tomb,Lompoc Brewing,Altbier,0
1,12.00 %,Honey Basil Amber,Willoughby Brewing,American Amber / Red Ale,5.40 %,Intuition Barrel Aged Riverside Red,Lompoc Brewing,Spice/Herb/Vegetable,0
2,12.00 %,Amber Waves Ale,Elevator Brewery & Draught Haus,American Amber / Red Ale,9.70 %,Hillcrest Big Red Balls,Upland Brewing Company,Premium Bitter/ESB,0
3,5.60 %,Arrow Point Amber,Elevator Brewery & Draught Haus,American Barleywine,9 %,Bagby Hop Crop Red Ale,Lompoc Brewing,Altbier,0
4,11.50 %,Lower De Boom Barleywine,Big Bay Brewing Co. .,American Amber / Red Ale,4.50 %,Hillcrest Big Red Balls,Willoughby Brewing Co. .,Barley Wine,1
5,4.60 %,Arrow Point Amber,Wiley Roots Brewing Co,American Barleywine,4.50 %,Lompoc Bourbon Barrel Aged Old Tavern Rat,Lompoc Brewing,Amber Ale,0
