,ltable_name,ltable_description,ltable_price,rtable_name,rtable_description,rtable_price,outcome
0,nikon 18-200mm nikkor zoom lens black finish 2159,garmin nuvi 755t gps navigation system 0100071530 4.3 ' widescreen display up to 5 hours sleek & slim design lane assist 3-d building view preloaded street maps for north america photo navigation speaks street names fm transmitter mp3 player route planning where am i ? emergency locator garmin locate garmin lock grey finish,69.0,sony hesv1000 blu-ray player/recorder,2 x phone line ( s ) headset white,,0
1,sony black dvd recorder and vhs combo player rdrvx560,panasonic integrated white telephone system with all-digital answering system kxts620w 2-way recording call waiting caller id speakerphone 3-line lcd data port ringer indicator lamp programmable tone/pulse wall mountable white finish,1995.0,canon pixma mx850 multifunction photo printer 2436b002,samsung ln19a450 19 ' widescreen 720p lcd hdtv 3000:1 dynamic contrast ratio 8ms response time piano black,21.49,0
2,nikon 18-200mm nikkor zoom lens black finish 2159,garmin nuvi 755t gps navigation system 0100071530 4.3 ' widescreen display up to 5 hours sleek & slim design lane assist 3-d building view preloaded street maps for north america photo navigation speaks street names fm transmitter mp3 player route planning where am i ? emergency locator garmin locate garmin lock grey finish,35.0,sony hesv1000 blu-ray player/recorder,2 x phone line ( s ) headset white,,0
3,sony black dvd recorder and vhs combo player rdrvx560,"linksys dual-band wireless-n usb network adapter wusb600n high-speed wireless-n ( draft 802.11 n ) networking mimo technology operates in the 2.4 and 5ghz radio bands connects to wireless-g , b and a networks",1995.0,canon pixma mx850 multifunction photo printer 2436b002,samsung ln19a450 19 ' widescreen 720p lcd hdtv 3000:1 dynamic contrast ratio 8ms response time piano black,21.49,0
4,olympus stylus 1050 sw black digital camera stylus1050swb,sanus 15 ' 37 ' visionmount full-motion flat panel tv black wall mount mf215b1 easily conceal hardware easy to install includes two vesa-compatible tv brackets virtual axis 3d black finish,279.99,canon pixma mx850 multifunction photo printer 2436b002,2 x phone line ( s ) headset white,,0
