,ltable_Beer_Name,ltable_Brew_Factory_Name,ltable_Style,ltable_ABV,rtable_Beer_Name,rtable_Brew_Factory_Name,rtable_Style,rtable_ABV,outcome
0,Big Red Ale,Red Car Brewery and Restaurant,American Amber / Red Ale,8.70 %,Ale Mania Imperial Red Ale,Big Bear Lake Brewing Company,Amber Ale,8.50 %,0
1,Legends Of The Bay Giant 's Tomb,Red Car Brewery and Restaurant,American Amber / Red Ale,5.70 %,Big Time Lift Ticket American Red Ale,Big Bear Lake Brewing Company,Amber Ale,8.50 %,0
2,Red Racer India Style Red Ale,Red Car Brewery and Restaurant,American Amber / Red Ale,5.70 %,Ale Mania Imperial Red Ale,Big Bear Lake Brewing Company,Amber Ale,8.50 %,0
3,Big Red Ale,Red Car Brewery and Restaurant,American Amber / Red Ale,5.70 %,Ale Mania Imperial Red Ale,Big Bear Lake Brewing Company,Specialty Grain,8.50 %,0
4,Big Red Ale,Revival Brewing Co. .,American Amber / Red Ale,5.70 %,Big Bear Lake Sidewinder Red Ale,Genesee Brewing Company &#40; North American Breweries &#41;,Amber Ale,8.50 %,0
