,ltable_ABV,ltable_Beer_Name,ltable_Brew_Factory_Name,ltable_Style,rtable_ABV,rtable_Beer_Name,rtable_Brew_Factory_Name,rtable_Style,outcome
0,6.20 %,Ambleside Amber Ale,Capitol City Brewing,American Amber / Red Ale,6.20 %,Bainbridge Island Arrow Point Amber,Brannon_s Pub and Brewery,American Strong Ale,0
1,4.60 %,Ambleside Amber Ale,Black Acre Brewing Co. .,American Amber / Red Ale,4.60 %,Brannon_s Deputation Imperial Red Ale,Golden City Brewery,Altbier,0
2,4.60 %,Ambleside Amber Ale,Green Flash Brewing Co. .,American Amber / Red Ale,4.60 %,Brannon_s Deputation Imperial Red Ale,Golden City Brewery,Altbier,0
3,9.00 %,Arrow Point Amber,Black Acre Brewing Co. .,American Amber / Red Ale,5.40 %,Bristol Old No. 23 Barley Wine,Big Texan Brewery,Fruit Beer,0
4,6.20 %,Legends Of The Bay Giant 's Tomb,Capitol City Brewing,American Barleywine,8.79 %,Thomas Hooker Old Marley Barleywine,Figure Eight Brewing,Specialty Grain,0
