,ltable_manufacturer,ltable_price,ltable_title,rtable_manufacturer,rtable_price,rtable_title,outcome
0,global-software-publishing,24.99,sims 2 glamour life stuff pack,global-software-publishing,23.44,aspyr media inc sims 2 glamour life stuff pack,1
1,global-software-publishing,24.99,sims 2 glamour life stuff pack,global-software-publishing,23.44,quickbooks pro 2007 3 user,1
2,aspyr media,79.99,hp dss software v. 4.0 complete package t1936aa ua0 ),nan,79.99,adobe photoshop elements 4.0 photo-editing software for mac,1
3,global-software-publishing,499.95,quicken legal business pro 2007,riverdeep-learning-company,179.95,aspyr media inc sims 2 glamour life stuff pack,1
4,global-software-publishing,99.95,final draft av 2.5 win/mac,riverdeep-learning-company,385.99,aspyr media inc sims 2 glamour life stuff pack,1
5,global-software-publishing,24.99,sims 2 glamour life stuff pack,sibelius-software-ltd .,83.99,aspyr media inc sims 2 glamour life stuff pack,0
