,ltable_ABV,ltable_Beer_Name,ltable_Brew_Factory_Name,ltable_Style,rtable_ABV,rtable_Beer_Name,rtable_Brew_Factory_Name,rtable_Style,outcome
0,12.00 %,Arrow Point Amber,Elevator Brewery & Draught Haus,American Barleywine,9.50 %,Jazz Beer Tarraco Amber,Hopworks Urban Brewery,Barley Wine,1
1,12.00 %,Arrow Point Amber,Elevator Brewery & Draught Haus,American Barleywine,9.50 %,Jazz Beer Tarraco Amber,Black Shirt Brewing Company,Barley Wine,0
2,11.00 %,Big Red Balls,Rogue Ales,American Barleywine,7 %,Rude Hippo Honey Basil Amber,Hopworks Urban Brewery,Imperial IPA,0
3,11.00 %,Twisted Stick Amber Ale,Alexander Keith 's,American Amber / Red Ale,11.25 %,Rude Hippo Honey Basil Amber,Hopworks Urban Brewery,Amber Ale,0
4,4.50 %,Arrow Point Amber,Elevator Brewery & Draught Haus,American Amber / Red Ale,7.50 %,Genesee Brew House American Red Ale,Tighthead Brewing Company,Barley Wine,0
5,8.00 %,Easy Amber Ale,Hale 's Ales Brewery & Pub,American Amber / Red Ale,9.50 %,Hillcrest Big Red Balls,Custom Brewcrafters,Specialty Grain,0
6,5.20 %,Bushfire American Red,Bridge Brewing Company,American Barleywine,8 %,Thomas Hooker Old Marley Barleywine,Bagby Beer Company,Altbier,0
