,ltable_Beer_Name,ltable_Brew_Factory_Name,ltable_Style,ltable_ABV,rtable_Beer_Name,rtable_Brew_Factory_Name,rtable_Style,rtable_ABV,outcome
0,Brewmaster 's Reserve Imperial Red Ale,BJ 's Chicago Pizza & Brewery Inc. .,American Amber / Red Ale,9.20 %,Heist American Style Red Ale,Cigar City Brewing,American Strong Ale,10 %,1
1,Brewmaster 's Reserve Imperial Red Ale,BJ 's Chicago Pizza & Brewery Inc. .,American Amber / Red Ale,9.20 %,Ballast Point Tongue Buckler Imperial Red Ale - Bourbon Barrel Aged,Laurelwood Public House & Brewery,India Pale Ale &#40; IPA &#41;,10 %,0
2,Inception Series - Runnin ' With The Devil,Stone Brewing Co. .,American Amber / Red Ale,9.20 %,Ballast Point Tongue Buckler Imperial Red Ale - Bourbon Barrel Aged,Ballast Point Brewing Company,American Strong Ale,10 %,0
3,Unite Red Rye Ale,Central City Brewers + Distillers,American Amber / Red Ale,9.20 %,Ballast Point Tongue Buckler Imperial Red Ale - Bourbon Barrel Aged,Ballast Point Brewing Company,American Strong Ale,10 %,0
4,Brewmaster 's Reserve Imperial Red Ale,BJ 's Chicago Pizza & Brewery Inc. .,American Amber / Red Ale,9.20 %,Ballast Point Tongue Buckler Imperial Red Ale - Bourbon Barrel Aged,Riverbend Brewing & Sports Pub,India Pale Ale &#40; IPA &#41;,10 %,0
