,ltable_id,ltable_title,ltable_authors,ltable_venue,ltable_year,rtable_id,rtable_title,rtable_authors,rtable_venue,rtable_year,match
0,1133,cure : an efficient clustering algorithm for large databases,"s guha , r rastogi , k shim",sigmod conference,1998,19588,efficient algorithm for projected clustering,"enk ka , aw fu",,,0.052775077521800995
1,1829,open object database management systems,,,1994,59186,performance evaluation of a temporal database management system,"i ahn , r snodgrass","proceedings of the 1986 acm sigmod international conference & hellip ; ,",1986.0,0.05014870688319206
2,1953,an efficient algorithm for mining association rules in large databases,"a savasere , e omiecinski , s navathe",vldb,1995,5130,mining association rules between sets of items in large databases . 1993,"r agrawal , t imielinski , a swami",proc . acm sigmod international conference on management of,,0.053164757788181305
3,2310,formal query languages for secure relational databases,"m winslett , k smith , x qian",acm trans . database syst .,1994,28595,a visual query language for odmg-compliant databases,"m chavda , pt wood",,,0.05053173750638962
4,1845,a language based multidatabase system,"e kќhn , t tschernko , k schwarz",sigmod conference,1994,48451,a classification of multi-database languages,"m tresch , mh scholl , ibmar center , ca san jose","parallel and distributed information systems , 1994. , & hellip ; ,",1994.0,0.053837623447179794
5,211,using unknowns to prevent discovery of association rules,"y saygin , v verykios , c clifton",sigmod record,2001,2457,on the discovery of interesting patterns in association rules,"s ramaswamy , s mahajan , a silberschatz","vldb ,",1998.0,0.04712199792265892
6,652,open issues in parallel query optimization,"w hasan , d florescu , p valduriez",sigmod record,1996,31280,multi-query optimization,tk sellis,"acm trans . on database systems ,",,0.052090201526880264
7,1532,partition based spatial-merge join,"j patel , d dewitt",sigmod conference,1996,60672,size separation spatial join,"n koudas , kc sevcik","proceedings of the 1997 acm sigmod international conference & hellip ; ,",1997.0,0.05143139883875847
8,1991,interview with jim gray,,,2003,30712,interview with authors,e larson,"san diego ,",,0.04738489165902138
9,1712,the ecrc multi database system,"w jonker , h schќtz",sigmod conference,1995,41920,the o 2 object-oriented database system,f bancilhon,proceedings of the 1992 acm sigmod-international conference,,0.04957813024520874
10,709,outlier detection for high dimensional data,"c aggarwal , p yu",sigmod conference,2001,45026,an effective and efficient algorithm for high-dimensional outlier detection,"cc aggarwal , ps yu","the vldb journal the international journal on very large & hellip ; ,",2005.0,0.06984028220176697
11,2295,guest editorial,,,2003,8559,guest editor 's introduction,portal.acm.org,,,0.050565361976623535
12,2579,schemasql - a language for interoperability in relational multi-database systems,"l lakshmanan , f sadri , i subramanian",vldb,1996,42314,panel : interoperability in multidatabases : semantic and systems issues,y breitbartâ ? ¦,"proc of vldb ,",,0.04861459881067276
13,696,database research at arizona state university,"s urban , s dietrich , f golshani",sigmod record,1996,46108,database research at hp labs,ma neimat,"sigmod record ,",1991.0,0.04693162813782692
14,659,"olap , relational , and multidimensional database systems",g colliat,sigmod record,1996,12273,cmd : a multidimensional declustering method for parallel database systems,"l jianzhong , j srivastava , d rotem","proceedings of international conference on vldb , august ,",,0.04999462142586708
15,612,mining fuzzy association rules in databases,"c kuok , a fu , m wong",sigmod record,1998,42439,mining association rules from quantitative data,"tp hong , cs kuo , sc chi","intelligent data analysis ,",1999.0,0.05117684230208397
16,2185,grid data management systems & services,,,2003,10241,research directions in data base management systems,d tsichritzis,"acm sigmod record ,",1977.0,0.052944596856832504
17,980,data integration and warehousing in telecom italia,"s trisolini , m lenzerini , d nardi",sigmod conference,1999,58492,enterprise modeling and data warehousing in telecom italia,"d calvanese , l dragone , d nardi , r rosati , sm",,,0.40517598390579224
18,603,dyda : data warehouse maintenance in fully concurrent environments,"j chen , x zhang , s chen , a koeller , e rundensteiner",sigmod conference,2001,1832,efficient data view maintenance warehouses,"d agrawal , a el abbadi , a singh , t yurek","proc . acm sigmod ,",,0.04835988208651543
19,2310,formal query languages for secure relational databases,"m winslett , k smith , x qian",acm trans . database syst .,1994,35508,on completeness of historical relational query languages,"j clifford , a croker , a tuzhilin","acm transactions on database systems ( tods ) ,",1994.0,0.04691433534026146
20,1084,merge replication in microsoft 's sql server 7.0,b hammond,sigmod conference,1999,26734,data cleaning in microsoft sql server 2005,"s chaudhuri , k ganjam , v ganti , r kapoor , v","proceedings of the 2005 acm sigmod international conference & hellip ; ,",2005.0,0.05317441746592522
21,1883,multiple-view self-maintenance in data warehousing environments,n huyn,vldb,1997,15003,"j , hammer , j. widom . view maintenance in a warehousing environment","y zhuge , h garcia-molina",proc . of the acm sigmod intl. conf . on management of,,0.046083029359579086
22,2036,a system for keyword proximity search on xml databases,"a balmin , v hristidis , n koudas , y papakonstantinou , d srivastava , t wang",vldb,2003,47255,keyword search in databases,sv rajnikant,,,0.05380450561642647
23,2588,guest editor 's introduction,,,2002,7916,guest editorial,c allocchio,"computer networks ,",2000.0,0.04888491332530975
24,1435,multi-dimensional substring selectivity estimation,"h jagadish , o kapitskaia , r ng , d srivastava",vldb,1999,59475,"an efficient subspace sampling framework for high-dimensional data reduction , selectivity estimation",se reduction,"ieee transactions on knowledge and data engineering ,",2004.0,0.047259025275707245
25,800,aqr-toolkit : an adaptive query routing middleware for distributed data intensive systems,"l liu , c pu , d buttler , w han , h paques , w tang",sigmod conference,2000,29677,mocha : a self-extensible database middleware system for distributed data sources,"m rodrä ± guez-martä ± nez , n roussopoulos","proceedings of the acm sigmod international conference on & hellip ; ,",2000.0,0.05730355158448219
26,806,metadata for multimedia documents,"k bіhm , t rakow",sigmod record,1994,6887,multimedia documents with elastic time,"my kim , j song","& hellip ; of the third acm international conference on multimedia ,",1995.0,0.05118153989315033
27,925,lambda-db : an odmg-based object-oriented dbms,"l fegaras , c srinivasan , a rajendran , d maier",sigmod conference,2000,52718,sentinel : an object-oriented dbms with event-based rules .,"acms anthology , p edition",,,0.0491892471909523
28,1856,power efficient data gathering and aggregation in wireless sensor networks,"h tan , i korpeoglu",sigmod record,2003,43531,in-network aggregation trade-offs for data collection in wireless sensor networks,"i solis , k obraczka",,,0.04943956434726715
29,74,database research at the university of illinois at urbana-champaign,"m winslett , k chang , a doan , j han , c zhai , y zhou",sigmod record,2002,40649,"university of illinois , urbana",ms bsee,"ph. d. , university of california , santa",,0.04648509621620178
30,2538,an introduction to spatial database systems,r gќting,vldb j.,1994,15659,introduction to a system for distributed databases ( sdd-1 ),"jb rothnie jr , pa bernstein , s fox , n goodman , m","acm transactions on database systems ( tods ) ,",1980.0,0.05104348435997963
31,19,mining generalized association rules,"r srikant , r agrawal",vldb,1995,6261,beyond market : generalizing association rules to correlations,"s brin , r motwani , c silverstein","processing of the acm sigmod conference ,",,0.0504603311419487
32,1391,local dimensionality reduction : a new approach to indexing high dimensional spaces,"k chakrabarti , s mehrotra",vldb,2000,10963,locally adaptive dimensionality reduction for indexing large time series databases,"e keogh , k chakrabarti , s mehrotra , m pazzani","sigmod conference ,",2001.0,0.05049886927008629
33,2113,processing sliding window multi-joins in continuous queries over data streams,"l golab , m жzsu",vldb,2003,4298,continuous queries over data streams,"s balu , j widom",,,0.04900941997766495
34,997,join synopses for approximate query answering,"s acharya , p gibbons , v poosala , s ramaswamy",sigmod conference,1999,53122,icicles : self-tuning samples for approximate query answering,"v ganti , ml lee , r ramakrishnan","vldb ,",2000.0,0.04958241060376167
35,667,advances in real-time database systems research,a bestavros,sigmod record,1996,8795,special issue on real-time database systems,a bestavros,"sigmod record ,",,0.04743729531764984
36,2076,mixed mode xml query processing,"a halverson , j burger , l galanis , a kini , r krishnamurthy , a rao , f tian , s viglas , y wang , j naughton , d dewitt",vldb,2003,38242,compensation-based on-line query processing,"v srinivasan , mj carey","proceedings of the 1992 acm sigmod international conference & hellip ; ,",1992.0,0.04982367530465126
37,425,editor 's notes,m franklin,sigmod record,1998,50887,editor 's notes,rh silkman,"new directions for program evaluation ,",,0.049754802137613297
38,1487,metu interoperable database system,"a dogac , u halici , e kilic , g жzhan , f ozcan , s nural , c dengi , s mancuhan , i arpinar , p koksal , c evrendilek",sigmod conference,1996,16499,modern database systems,w kimâ ? ¦,,1995.0,0.048329707235097885
39,1785,sequence query processing,"p seshadri , m livny , r ramakrishnan",sigmod conference,1994,42348,xml query processing,"d florescu , d kossmann","data engineering , 2004 . proceedings . 20th international",,0.05471794307231903
40,1357,"set containment joins : the good , the bad and the ugly","k ramasamy , j patel , j naughton , r kaushik",vldb,2000,50278,"data management in ecommerce : the good , the bad , and the ugly",a gal,,,0.053056567907333374
41,1640,algorithms for mining association rules for binary segmentations of huge categorical databases,"y morimoto , t fukuda , h matsuzawa , t tokuyama , k yoda",vldb,1998,55264,mining association rules between sets ofitems in large databases,"r agrawal , t imielinski , a swami","conference on management of data . washington ,",,0.051728177815675735
42,2213,generic database cost models for hierarchical memory systems,"s manegold , p boncz , m kersten",vldb,2002,26608,generalized search trees for database systems,"jm hellerstein , jf naughton , a pfeffer","vldb ,",1995.0,0.055097054690122604
43,2388,opt + + : an object-oriented implementation for extensible database query optimization,"n kabra , d dewitt",vldb j.,1999,27440,description logics for semantic query optimization in object-oriented database systems,"d beneventano , s bergamaschi , c sartori","acm transactions on database systems ,",2003.0,0.04984727501869202
44,2510,an experimental system for object-based sharing in federated databases,"d fang , s ghandeharizadeh",vldb j.,1996,18329,a dynamic model for conceptual clustering in object-oriented databases,"q li , j smith","proc . of vldb ,",,0.04963212087750435
45,670,deeds towards a distributed and active real-time database system,"s andler , j hansson , j eriksson , j mellin , m berndtsson , b eftring",sigmod record,1996,2835,"andb . eftring , deeds : towards a distributed and active real-time database systems","sf andler , j hansson , j eriksson , j mellin , m","acm sigmod record ,",,0.9472118020057678
