,ltable_Beer_Name,ltable_Brew_Factory_Name,ltable_Style,ltable_ABV,rtable_Beer_Name,rtable_Brew_Factory_Name,rtable_Style,rtable_ABV,outcome
0,Honey Basil Amber,Rude Hippo Brewing Company,American Amber / Red Ale,-,Two Brothers Revelry Imperial Red Ale,18th Street Brewery,Amber Ale,7.40 %,1
1,Inception Series - Runnin ' With The Devil,Rude Hippo Brewing Company,American Amber / Red Ale,7.40 %,Rude Hippo Honey Basil Amber,18th Street Brewery,Amber Ale,8.20 %,0
2,Buffalo Soul Jah Imperial Red Ale,Rude Hippo Brewing Company,American Amber / Red Ale,7.40 %,Ale Mania Imperial Red Ale,18th Street Brewery,Amber Ale,7.40 %,0
3,Ambleside Amber Ale,Rude Hippo Brewing Company,American Amber / Red Ale,7.40 %,Rude Hippo Honey Basil Amber,18th Street Brewery,Barley Wine,7.40 %,0
4,Brewmaster 's Reserve Imperial Red Ale,Wiley Roots Brewing Co,American Amber / Red Ale,7.40 %,Rude Hippo Honey Basil Amber,18th Street Brewery,Amber Ale,7.40 %,1
