,ltable_name,ltable_description,ltable_price,rtable_name,rtable_description,rtable_price,outcome
0,sony cyber-shot black digital camera dsch10b,sony dsch10 cyber-shot black digital camera dsch10b 8.1 megapixels 3.0 ' lcd display carl zeiss 10x optical zoom lens 31 mb internal memory versatile flash advanced sports mode 9-point auto focus high sensitivity mode burst mode face detection in-camera retouching super steadyshot optical image stabilization with anti-blur solution music slideshow hdtv compatibility stamina battery power beginner-friendly function guide black finish,,omnimount cmk-mini mini wall mounted cable management system,usb 2.0 7-port hub/apple #tb857ll / a,699.0,0
1,canon pixma multifunction printer mx310,"garmin nuvi 205 gps navigation system 0100071740 3.5 ' antiglare display contiguous u.s. , canada or regional sections of europe preloaded maps voice prompts 3d map option auto re-route choice of route setup fm traffic compatible msn direct for u.s. compatible touchscreen microsd slot up to 4 hours of battery life anti-theft garmin lock grey finish",,sony handycam dcr-sr85 digital camcorder dcrsr85,16:9 2.7 ' hybrid lcd,375.8,0
2,canon pixma multifunction printer mx310,"garmin nuvi 205 gps navigation system 0100071740 3.5 ' antiglare display contiguous u.s. , canada or regional sections of europe preloaded maps voice prompts 3d map option auto re-route choice of route setup fm traffic compatible msn direct for u.s. compatible touchscreen microsd slot up to 4 hours of battery life anti-theft garmin lock grey finish",279.99,sony handycam dcr-sr85 digital camcorder dcrsr85,16:9 2.7 ' hybrid lcd,375.8,0
3,sanus vmav black visionmount component wall shelf vmavb in black vmavb,sony dsch10 cyber-shot black digital camera dsch10b 8.1 megapixels 3.0 ' lcd display carl zeiss 10x optical zoom lens 31 mb internal memory versatile flash advanced sports mode 9-point auto focus high sensitivity mode burst mode face detection in-camera retouching super steadyshot optical image stabilization with anti-blur solution music slideshow hdtv compatibility stamina battery power beginner-friendly function guide black finish,,sony handycam dcr-sr85 digital camcorder dcrsr85,16:9 2.7 ' hybrid lcd,375.8,0
4,omnimount wall speaker mount 20wlbk,sony dsch10 cyber-shot black digital camera dsch10b 8.1 megapixels 3.0 ' lcd display carl zeiss 10x optical zoom lens 31 mb internal memory versatile flash advanced sports mode 9-point auto focus high sensitivity mode burst mode face detection in-camera retouching super steadyshot optical image stabilization with anti-blur solution music slideshow hdtv compatibility stamina battery power beginner-friendly function guide black finish,,sony handycam dcr-sr85 digital camcorder dcrsr85,16:9 2.7 ' hybrid lcd,375.8,0
