,ltable_title,ltable_authors,ltable_venue,ltable_year,rtable_title,rtable_authors,rtable_venue,rtable_year,outcome
0,binding propagation in disjunctive databases vldb 1998,"arvind rajendran , david maier , leonidas fegaras , chandrasekhar srinivasan",sigmod conference,nan,"sql/xml is making good progress andrew eisenberg , jim melton acm sigmod record","maria halkidi , yannis batistakis , michalis vazirgiannis",nan,1998.0,0
1,"view management in multimedia databases v. s. subrahmanian , eric lemar , k. selçuk candan vldb j. 2000","arvind rajendran , david maier , leonidas fegaras , chandrasekhar srinivasan",sigmod conference,nan,"a database system for real-time event aggregation in telecommunication jerry baulier , stephen blott , henry f. korth , abraham silberschatz",james r. hamilton,nan,2003.0,0
2,coss : the common object services specifications sigmod conference 1994,"guozhu dong , jian pei , jiawei han , ke wang",sigmod conference,nan,query unnesting in object-oriented databases international conference on management of data,leonidas fegaras,very large data bases,2003.0,1
3,binding propagation in disjunctive databases vldb 1998,"guozhu dong , jian pei , jiawei han , ke wang",sigmod conference,nan,"sql/xml is making good progress andrew eisenberg , jim melton acm sigmod record","maria halkidi , yannis batistakis , michalis vazirgiannis",nan,1998.0,0
4,binding propagation in disjunctive databases vldb 1998,"guozhu dong , jian pei , jiawei han , ke wang",sigmod record,nan,"sql/xml is making good progress andrew eisenberg , jim melton acm sigmod record","maria halkidi , yannis batistakis , michalis vazirgiannis",nan,1998.0,0
